policy,workflow,claim_tier,all_control_rate,all_bacc,all_sensitivity,all_specificity,all_fn,all_fp,all_remaining_errors,strict_external_control_rate,strict_external_bacc,strict_external_sensitivity,strict_external_specificity,strict_external_fn,strict_external_fp,strict_external_remaining_errors,interpretation
pure_auto,Pure auto,Baseline,0.00%,82.16%,81.11%,83.22%,51,72,123,0.00%,70.11%,68.09%,72.13%,15,17,32,Shows why direct automatic diagnosis is insufficient across domains.
v50_main,Fixed v50,Stable baseline workflow,72.68%,97.94%,97.04%,98.83%,8,5,13,73.15%,97.30%,97.87%,96.72%,1,2,3,Lowest-cost workflow satisfying basic cross-domain constraints in v93.
adaptive_v50_to_v79_light,Batch-adaptive main,Primary deployable workflow,74.11%,98.24%,97.41%,99.07%,7,4,11,82.41%,99.18%,100.00%,98.36%,0,1,1,Unlabeled batch audit keeps internal review lower and escalates severe-shift batches.
v79_light_lowrisk_guard,Fixed v79-light,Primary high-safety fixed workflow,78.97%,98.84%,98.15%,99.53%,5,2,7,82.41%,99.18%,100.00%,98.36%,0,1,1,Selected by v93 high-safety constraints when strict external is held out.
v79_strict_lowrisk_guard,Fixed v79-strict,High-specificity candidate,82.55%,99.07%,98.15%,100.00%,5,0,5,87.04%,100.00%,100.00%,100.00%,0,0,0,Removes low-risk overcall at higher review rate; needs further external validation.
quality_direction_uniform90,Quality+direction uniform90,High-review upper-bound candidate,89.84%,99.88%,100.00%,99.77%,0,1,1,89.81%,99.18%,100.00%,98.36%,0,1,1,"Best current all-domain error reduction, but review/control rate is near 90%."
