stage,module,evidence,current_status,paper_claim,main_limitation,next_action
Stage 1,Primary image classifier / selective auto-pass backbone,Previous v50/v79/v118-v119 family establishes the high-safety workflow and two-signal risk card on old+third+strict external.,main workflow backbone,Use as the base diagnostic engine; do not present later auto-correction experiments as replacing the primary classifier.,"The remaining innovation must come from risk control and cross-domain handling, not from claiming a single stronger classifier.","Keep the backbone fixed when testing safety modules, unless a new model is validated by the same leave-domain and external protocol."
Stage 2,Direction-aware router,"v148 strict external image-direction router BAcc 80.6% vs low-conf 78.1%, Delta +2.49 pp; concept-direction review Delta +1.12 pp.",candidate supported by point-estimate gain,"Direction-aware routing is more informative than ordinary confidence for severe-shift triage, but the matched CI still crosses zero.",External sample size is small; significance is trend-level.,Use as a framework component and evaluate prospective external batches; avoid claiming statistically proven superiority yet.
Stage 3,Image-distilled concept / pseudo-severe automatic correction,"v155 concept-direction rule: flips 35, rescued 31, hurt 4, BAcc 77.1%, Delta BAcc +23.88 pp; ordinary-domain boundary: old_data: flips 59, net -17, rescued 21, hurt 38, Delta BAcc -6.10 pp; third_batch: flips 60, net -18, rescued 21, hurt 39, Delta BAcc -10.59 pp",severe-shift-only candidate,"Doctor-derived concepts are not useful as naive direct inputs, but they can supervise a direction-aware correction signal under severe shift.",Unsafe as a global auto-flip rule; needs a reliable severe-shift gate.,Develop a no-label severe-shift gate and a second severe-shift validation batch before locking automatic correction.
Stage 4,Unlabeled shift gate for safe correction,"v156 internal max shift index 0.969, strict external 2.324; gated strict-external Delta BAcc +23.88 pp; false old/third gate -6.10 pp/-10.59 pp.",core safety boundary evidence,Automatic correction must be conditional on batch-level shift detection; otherwise it can harm ordinary domains.,Current separation is shown on existing batches; more external batches are required to calibrate a deployable threshold.,"Treat uncertain gate cases as review/rejection, not auto-correction."
Stage 5,Reject / clinical review fallback,v151/v153 show safe all-domain auto-flip collapses to zero or near-zero coverage; v156 shows false severe-shift triggers are harmful.,required safety layer,Rejection is not a failure mode; it is the safety mechanism that prevents unsafe correction when the model cannot verify the domain state.,Review burden must be reported with accuracy; high accuracy without review-rate accounting is incomplete.,"Report auto-pass, auto-correct, and reject/review proportions together for every dataset."
